{
  "generated_at": "2026-02-24",
  "center": "Des Moines, IA",
  "center_lat": 41.5868,
  "center_lon": -93.625,
  "artist_shows": {
    "Luke Combs": [
      {
        "date": "Mar 21, 2026",
        "venue": "T-Mobile Arena",
        "city": "Las Vegas, NV",
        "status": "on_sale",
        "lat": 36.1674263,
        "lon": -115.1484131,
        "is_new": true
      },
      {
        "date": "Apr 4, 2026",
        "venue": "John Paul Jones Arena",
        "city": "Charlottesville, VA",
        "status": "on_sale",
        "lat": 38.029306,
        "lon": -78.4766781,
        "is_new": true
      },
      {
        "date": "Apr 11, 2026",
        "venue": "Jack Trice Stadium",
        "city": "Ames, IA",
        "status": "on_sale",
        "lat": 42.0347,
        "lon": -93.62,
        "is_new": false
      },
      {
        "date": "Apr 18, 2026",
        "venue": "Notre Dame Stadium",
        "city": "South Bend, IN",
        "status": "on_sale",
        "lat": 41.6833813,
        "lon": -86.2500066,
        "is_new": true
      },
      {
        "date": "Apr 25, 2026",
        "venue": "Ohio Stadium",
        "city": "Columbus, OH",
        "status": "on_sale",
        "lat": 39.9622601,
        "lon": -83.0007065,
        "is_new": true
      },
      {
        "date": "May 2, 2026",
        "venue": "Neyland Stadium",
        "city": "Knoxville, TN",
        "status": "on_sale",
        "lat": 35.9603948,
        "lon": -83.9210261,
        "is_new": true
      },
      {
        "date": "May 9, 2026",
        "venue": "Gaylord Family Oklahoma Memorial Stadium",
        "city": "Norman, OK",
        "status": "on_sale",
        "lat": 35.2225717,
        "lon": -97.4394816,
        "is_new": true
      },
      {
        "date": "May 15, 2026",
        "venue": "Lambeau Field",
        "city": "Green Bay, WI",
        "status": "on_sale",
        "lat": 44.5126379,
        "lon": -88.0125794,
        "is_new": true
      },
      {
        "date": "May 16, 2026",
        "venue": "Lambeau Field",
        "city": "Green Bay, WI",
        "status": "on_sale",
        "lat": 44.5126379,
        "lon": -88.0125794,
        "is_new": true
      },
      {
        "date": "May 29, 2026",
        "venue": "Percival Molson Memorial Stadium",
        "city": "Montreal, QC",
        "status": "on_sale",
        "lat": 45.5031824,
        "lon": -73.5698065,
        "is_new": true
      },
      {
        "date": "May 30, 2026",
        "venue": "Percival Molson Memorial Stadium",
        "city": "Montreal, QC",
        "status": "on_sale",
        "lat": 45.5031824,
        "lon": -73.5698065,
        "is_new": true
      },
      {
        "date": "Jun 5, 2026",
        "venue": "Rogers Centre",
        "city": "Toronto, ON",
        "status": "on_sale",
        "lat": 43.6534817,
        "lon": -79.3839347,
        "is_new": true
      },
      {
        "date": "Jun 6, 2026",
        "venue": "Rogers Centre",
        "city": "Toronto, ON",
        "status": "on_sale",
        "lat": 43.6534817,
        "lon": -79.3839347,
        "is_new": true
      }
    ],
    "Morgan Wallen": [],
    "Zach Bryan": [
      {
        "date": "Mar 7, 2026",
        "venue": "The Dome at America's Center",
        "city": "St. Louis, MO",
        "status": "on_sale",
        "lat": 38.6254063,
        "lon": -90.190009,
        "is_new": true
      },
      {
        "date": "Mar 14, 2026",
        "venue": "Raymond James Stadium",
        "city": "Tampa, FL",
        "status": "on_sale",
        "lat": 27.9449854,
        "lon": -82.4583107,
        "is_new": true
      },
      {
        "date": "Mar 21, 2026",
        "venue": "The Alamodome",
        "city": "San Antonio, TX",
        "status": "on_sale",
        "lat": 29.4246002,
        "lon": -98.4951405,
        "is_new": true
      },
      {
        "date": "Mar 28, 2026",
        "venue": "Tiger Stadium",
        "city": "Baton Rouge, LA",
        "status": "on_sale",
        "lat": 30.4494155,
        "lon": -91.1869659,
        "is_new": true
      },
      {
        "date": "Apr 3, 2026",
        "venue": "H.A. Chapman Stadium",
        "city": "Tulsa, OK",
        "status": "on_sale",
        "lat": 36.1563122,
        "lon": -95.9927516,
        "is_new": true
      },
      {
        "date": "Apr 4, 2026",
        "venue": "H.A. Chapman Stadium",
        "city": "Tulsa, OK",
        "status": "on_sale",
        "lat": 36.1563122,
        "lon": -95.9927516,
        "is_new": true
      },
      {
        "date": "Apr 11, 2026",
        "venue": "L&N Federal Credit Union Stadium",
        "city": "Louisville, KY",
        "status": "on_sale",
        "lat": 38.2542376,
        "lon": -85.759407,
        "is_new": true
      },
      {
        "date": "Apr 18, 2026",
        "venue": "Bank of America Stadium",
        "city": "Charlotte, NC",
        "status": "on_sale",
        "lat": 35.2272086,
        "lon": -80.8430827,
        "is_new": true
      },
      {
        "date": "Apr 25, 2026",
        "venue": "Memorial Stadium",
        "city": "Lincoln, NE",
        "status": "on_sale",
        "lat": 40.8136,
        "lon": -96.7026,
        "is_new": false
      },
      {
        "date": "May 2, 2026",
        "venue": "Davis Wade Stadium",
        "city": "Starkville, MS",
        "status": "on_sale",
        "lat": 33.4638745,
        "lon": -88.8152074,
        "is_new": true
      },
      {
        "date": "May 9, 2026",
        "venue": "Huntington Bank Field",
        "city": "Cleveland, OH",
        "status": "on_sale",
        "lat": 41.4996574,
        "lon": -81.6936772,
        "is_new": true
      },
      {
        "date": "Jul 25, 2026",
        "venue": "Autzen Stadium",
        "city": "Eugene, OR",
        "status": "on_sale",
        "lat": 44.0505054,
        "lon": -123.0950506,
        "is_new": true
      },
      {
        "date": "Jul 31, 2026",
        "venue": "Snapdragon Stadium",
        "city": "San Diego, CA",
        "status": "on_sale",
        "lat": 32.7174202,
        "lon": -117.162772,
        "is_new": true
      },
      {
        "date": "Aug 1, 2026",
        "venue": "Snapdragon Stadium",
        "city": "San Diego, CA",
        "status": "on_sale",
        "lat": 32.7174202,
        "lon": -117.162772,
        "is_new": true
      },
      {
        "date": "Aug 7, 2026",
        "venue": "Rice-Eccles Stadium",
        "city": "Salt Lake City, UT",
        "status": "on_sale",
        "lat": 40.7596198,
        "lon": -111.886797,
        "is_new": true
      },
      {
        "date": "Aug 13, 2026",
        "venue": "Empower Field at Mile High",
        "city": "Denver, CO",
        "status": "on_sale",
        "lat": 39.7392364,
        "lon": -104.984862,
        "is_new": true
      },
      {
        "date": "Aug 14, 2026",
        "venue": "Empower Field at Mile High",
        "city": "Denver, CO",
        "status": "on_sale",
        "lat": 39.7392364,
        "lon": -104.984862,
        "is_new": true
      },
      {
        "date": "Aug 22, 2026",
        "venue": "AT&T Stadium",
        "city": "Arlington, TX",
        "status": "on_sale",
        "lat": 32.7355816,
        "lon": -97.1071186,
        "is_new": true
      },
      {
        "date": "Sep 5, 2026",
        "venue": "State Farm Stadium",
        "city": "Glendale, AZ",
        "status": "on_sale",
        "lat": 33.5386858,
        "lon": -112.185994,
        "is_new": true
      },
      {
        "date": "Sep 18, 2026",
        "venue": "The Woodlands",
        "city": "Dover, DE",
        "status": "on_sale",
        "lat": 39.158168,
        "lon": -75.5243682,
        "is_new": true
      },
      {
        "date": "Sep 19, 2026",
        "venue": "The Woodlands",
        "city": "Dover, DE",
        "status": "on_sale",
        "lat": 39.158168,
        "lon": -75.5243682,
        "is_new": true
      },
      {
        "date": "Sep 21, 2026",
        "venue": "Rogers Centre",
        "city": "Toronto, ON",
        "status": "on_sale",
        "lat": 43.6534817,
        "lon": -79.3839347,
        "is_new": true
      },
      {
        "date": "Sep 22, 2026",
        "venue": "Rogers Centre",
        "city": "Toronto, ON",
        "status": "on_sale",
        "lat": 43.6534817,
        "lon": -79.3839347,
        "is_new": true
      },
      {
        "date": "Oct 2, 2026",
        "venue": "Gillette Stadium",
        "city": "Foxborough, MA",
        "status": "on_sale",
        "lat": 42.0653768,
        "lon": -71.2478308,
        "is_new": true
      },
      {
        "date": "Oct 3, 2026",
        "venue": "Gillette Stadium",
        "city": "Foxborough, MA",
        "status": "on_sale",
        "lat": 42.0653768,
        "lon": -71.2478308,
        "is_new": true
      },
      {
        "date": "Oct 10, 2026",
        "venue": "Jordan-Hare Stadium",
        "city": "Auburn, AL",
        "status": "on_sale",
        "lat": 32.6098566,
        "lon": -85.4807825,
        "is_new": true
      }
    ],
    "Tyler Childers": [
      {
        "date": "Apr 23, 2026",
        "venue": "Dos Equis Amphitheatre",
        "city": "Dallas, TX",
        "status": "on_sale",
        "lat": 32.7762719,
        "lon": -96.7968559,
        "is_new": true
      },
      {
        "date": "Apr 25, 2026",
        "venue": "Champions Square",
        "city": "New Orleans, LA",
        "status": "on_sale",
        "lat": 29.9561422,
        "lon": -90.0733934,
        "is_new": true
      },
      {
        "date": "Jun 4, 2026",
        "venue": "Protective Stadium",
        "city": "Birmingham, AL",
        "status": "on_sale",
        "lat": 33.5206824,
        "lon": -86.8024326,
        "is_new": true
      },
      {
        "date": "Jun 5, 2026",
        "venue": "Bon Secours Wellness Arena",
        "city": "Greenville, SC",
        "status": "on_sale",
        "lat": 34.851354,
        "lon": -82.3984882,